,Title,Views,Channel,Comment Count,Likes,Dislikes,Tags,Favourite Count,Video ID
0,Rescuing Hurricane Victims From Their Homes...,10042005,Jake Paul,100447,580317,29212,"['Jake', 'Paul', 'logan', 'paul', 'its', 'every', 'day', 'Team', '10', 'bro', 'funny', 'wow', 'crazy', 'vlog', 'adventure', 'disney', 'channel', 'girls', 'vine', 'hot', 'cool', 'fun', 'team', 'lucas', 'marcus', 'dobre', 'actor', 'star', 'daily', 'brothers', 'bizaardvark', 'tv', 'los', 'angeles', 'hollywood', 'sexy', 'comedy', 'skits', 'instagram', 'facebook', 'logang', 'jakepaulers', 'family', 'friendly', 'pg', 'kids', 'tai', 'lopez', 'erika', 'costell', 'evacuation', 'victims', 'homes', 'water', 'flood', 'harvey', 'hurricane', 'disaster', 'wether', 'tornado']",0,0gWnxLo4XAE
1,FANS SAVING HURRICANE HARVEY VICTIMS (incredible),4847223,Jake Paul,43390,259494,30229,"['Jake', 'Paul', 'logan', 'paul', 'its', 'every', 'day', 'Team', '10', 'bro', 'funny', 'wow', 'crazy', 'vlog', 'adventure', 'disney', 'channel', 'girls', 'vine', 'hot', 'cool', 'fun', 'team', 'lucas', 'marcus', 'dobre', 'actor', 'star', 'daily', 'brothers', 'bizaardvark', 'tv', 'los', 'angeles', 'hollywood', 'sexy', 'comedy', 'skits', 'instagram', 'facebook', 'logang', 'jakepaulers', 'family', 'friendly', 'pg', 'kids', 'tai', 'lopez', 'erika', 'costell', 'saving', 'help', 'in', 'need', 'families', 'disaster', 'natural', 'hurricane', 'lost', 'homes', 'harvey', 'tornado', 'weather']",0,0KK3m-bRBCM
2,"Hawk hides from Hurricane Harvey in taxi, refuses to leave",4091230,IBTimes UK,6382,67533,1194,"['Hurricane Harvey', 'harvey hurricane hawk', 'texas hurricane', 'u.s. emergency warning']",0,4Jjh2XdpQYE
3,Miley Cyrus Moved To Tears Over Hurricane Harvey,2607363,TheEllenShow,6704,48744,4898,"['hurricane harvey', 'spca', 'harvey path', 'hurricane harvey path', 'texas hurricane', 'houston', 'red cross', 'the red cross', 'ellen', 'degeneres', 'ellen degeneres', 'the ellen show', 'ellentube', 'ellen fans', 'hurricane harvey update', 'american red cross', 'salvation army', 'hurricane harvey relief', 'miley cyrus', 'miley', 'hannah montana']",0,IKk_XpcS9ok
4,"Trump Ends DACA, Responds to Hurricane Harvey: A Closer Look",2567013,Late Night with Seth Meyers,4834,29204,2544,"['late night', 'seth meyers', 'late night with seth meyers', 'jake tapper', 'gwendoline christie', 'top of the lake', 'gary clark jr.', 'closer look', 'daca', 'trump', 'hurricane harvey', 'NBC', 'NBC TV', 'television', 'funny', 'talk show', 'comedy', 'stand-up', 'parody', 'snl seth meyers', 'seth', 'meyers', 'weekend update', 'news satire', 'challenges', 'threats', 'americans', 'aftermath', 'hurricane', 'tiny hands', 'hands too big', 'thank you', 'turnout', 'crowd', 'a wonderful thing', 'prayer', 'a gift', 'helicopters', 'rescue', 'media', 'sessions', 'dreamers', 'difficult', 'mcconnell']",0,qWFydl-nFsw
5,"Thanks to Hurricane Harvey, the ""Dealmaker President"" Finally Makes a Deal: The Daily Show",2103831,The Daily Show with Trevor Noah,2328,29867,895,"['the daily show', 'trevor noah', 'daily show with trevor noah', 'new trevor noah show', 'comedy central politics', 'the daily show episodes', 'Thanks to Hurricane Harvey', 'the', 'late night talk show hosts', 'comedy central', 'stand up comedy', 'comedians', 'comedy central comedians', 'comedy', 'funny', 'comedian', 'funny video', 'comedy videos', 'stand up videos', 'funny jokes', 'funny clips', 'hilarious videos', 'hilarious clips']",0,tX7why_IWsk
6,Family Brings Baby Cow Into Their Home During Hurricane | The Dodo: Comeback Kids S02E01,2077286,The Dodo,4763,57673,868,"['animal video', 'animals', 'the dodo', 'Animal Rescue', 'baby cow', 'baby cow rescue', 'cow dog', 'cow and dog friends', 'cow', ""cow thinks it's a dog"", ""cow thinks it's a puppy"", ""cow thinks she's a dog"", 'cow videos kids', 'funny cow', 'puppycow', 'hurricane harvey', 'hurricane harvey pet rescue', 'hurricane cow', 'hurricane cow rescue', 'Harveigh', 'Harveigh the cow', 'comeback kids the dodo', 'comeback kids cow', 'cow in house', 'cow opens door', 'cow video', 'cow and dog playing', 'comeback kids', 'harvey cow', 'dodo cow']",0,K4jIAdAUjHc
7,Hurricane Floods A city under water Hurricane Harvey #Houston,2011669,Tony's - 24/7 Eyes,2432,3678,922,"['Houston Highways', 'hobby airport', 'hurricane harvey', 'hurricane irma', 'florida', 'hurricane season']",0,yLQXIJuCCD8
8,Hurricane Harvey looters get a SURPRISE!!!,1981642,TexasProud,8532,20094,2153,['__UNKNOWN__'],0,R_GhtfUUR7s
9,Jake Paul the HERO of Hurricane Harvey! #DramaAlert FaZe Banks vs News! iDubbbz & FouseyTube,1757106,DramaAlert,22119,98935,8697,"['#DramaAlert', 'Drama', 'Alert', 'DramaAlert', 'keemstar', 'youtube news', 'jake paul', 'team 10', 'jake paul hurricane', 'jake paul hurricane harvey', 'hurricane harvey', 'team 10 hurricane', 'fanjoy', 'uncle kade team 10', 'FaZe Banks', 'iDubbbz', 'FouseyTube', 'tessa brooks', 'car accident', 'houston jake paul']",0,wdb_yDZQvK0
10,Harvey the Hurricane Hawk: Scared Hawk in Taxi Finds Man Who Will Help | The Dodo,1750554,The Dodo,3849,44945,634,"['animal video', 'animals', 'the dodo', 'Rescue', 'Animal Rescue', 'Hurricane Harvey Hawk', 'Harvey Hawk', 'Harvey the Hurrican Hawk', 'Hurricane Harvey', 'Hurricane Harvey bird', 'Scared Hawk', 'hawk hurricane', 'hawk lands in mans car', 'texas hawk', 'hawk', 'hawk call', 'hawk in cab', 'hawk in taxi', 'hawk noise', 'hawk screech', 'hawkman', 'hawkwind', 'hawk in car', 'Harvey the Hurricane Hawk update', 'William Bruso', 'hurricane harvey damage', 'hurricane harvey hawk cab', 'hurricane harvey pets', 'hurricane harvey pets rescue']",0,Va-S9lIGDOU
11,My HURRICANE HARVEY Story- So Scary!,1421816,grav3yardgirl,11712,62293,1207,"['beauty', 'how to', 'makeup', 'howto', 'style', 'fashion', 'summer', 'spring', 'new', 'clothes', 'clothing', 'bunny', '2017', 'hurricane', 'hurricane harvey', 'houston', 'flood']",0,Djxo2NSk-Gk
12,"Saving the M3's From Hurricane Harvey-Houston, tx",1325058,TEXAS E36 Garage,2106,15862,695,"['hurricane harvey', 'hurricane', 'harvey', 'e36m3', 'e36 m3', 'e36', 'm3', 'x5', 'e53', 'savethem3', 'houston', 'texas', 'texas e36 garage', 'texas e36', 'e36 garage', 'garage', 'flooding', 'flooding 2017', 'e36 flooding', 'jacks', 'i need a lift', 'bmw', 'bmw e36', 'bmw e36 m3', 'bmw e36 world']",0,SYkdmHi6KpQ
13,YouTubers Helping with Hurricane Harvey #DramaAlert Team Rubicon!,1268808,DramaAlert,10555,75821,4105,"['#DramaAlert', 'Drama', 'Alert', 'DramaAlert', 'keemstar', 'youtube news', 'romanatwood', 'Hurricane Harvey', 'kidbehindacamera', 'mcjuggernuggets', 'team rubicon']",0,FtJA0Px7nbI
14,Hurricane Harvey VLOG: Part 2,1224104,It's a Buzz World,0,13845,361,"['Quintuplets', 'quints', 'Busby Quintuplets', 'Busby Quints', 'Busby Family', 'Babies', 'All Girl Quintuplets', 'All girl Quints', 'OutDaughtered', 'Outdaughtered full episodes', ""it's a buzz world"", 'itsabuzzworld', 'Buzz World', 'Buzz Family', 'Adam Busby', 'Danielle Busby', 'TLC', 'Reality TV', 'Identical Twins', 'Twins', 'Triplets', 'Multiples', 'Multiple births', 'Quadruplets', 'Quads', 'Blayke Busby', 'Hazel Grace', 'Hazel Busby', 'Ava Busby', 'Olivia Busby', 'Parker Busby', 'Riley Busby', 'houston', 'hurricane harvey']",0,Msmx5DfTZwY
15,Heroes of Hurricane Harvey,1219460,Good Mythical Morning,3436,37561,462,"['gmm', 'good mythical morning', 'gmm will it', 'good mythical morning will it', 'Rhett', 'link', 'rhett and link', 'Rhett link', 'gmm taste test', 'mythical morning', 'mythical', 'season 12', 'hurricane harvey', 'rhett link hurricane harvey', 'gmm hurricane harvey', 'rhett link houston', 'gmm houston', 'hurricane harvey houston', 'houston', 'texas', 'hurricane', 'harvey', 'flooding', 'texas hurricane', 'hurricane harvey update', 'hurricane harvey relief', 'gmm hurricane relief', 'rhett link hurricane relief', 'gmm texas', 'rhett link texas']",0,6873RCZk1Do
16,Hurricane Harvey warning: Beware of alligators,1217173,Fox Business,1060,3088,281,"['Dagen Mcdowell', 'Mornings With Maria', 'Apple News', 'News', 'On Air', 'Personality', 'Special', 'Fox Business']",0,mnZXgxDIahg
17,Jake Paul's Using Hurricane Harvey For Views,1170058,Kavos,21660,69894,10090,"['Jake Paul Using Hurricane Harvey', 'Jake Paul Hurricane Harvey', 'Jake Paul Hurricane', 'Jake Paul Hurricane Views', 'Jake Paul Using Hurricane', 'Jake Paul Hurricane Exposed', 'Jake Paul Harvey Exposed', 'Jake Paul Views', 'Jake Paul Exposed', 'Video Exposed Jake Paul', 'Using Hurricane Harvey For Views', 'Hurricane Harvey Views', 'Hurricane Harvey Exposed', 'Jake Paul Hurricane Harvey Texas', 'Jake Paul', 'hurricane harvey', 'Exposed', 'Kavos', 'Kavos Jake Paul', 'Kavos Jake', 'Exposing Jake Paul']",0,XaxaqeZV-Ys
18,"Kevin Hart Donates $25,000 To Hurricane Harvey Victims, Challenges Celebrities To As Well | NBC News",1158523,NBC News,5969,26355,1935,"['nbc news', 'nbc', 'news', 'news channel', 'news station', 'newspaper', 'breaking news', 'us news', 'world news', 'politics', 'nightly news', 'current events', 'top stories', 'pop culture', 'business', 'health', 'kevin hart donates to hurricane victims', 'hurricane harvey', 'kevin hart', 'instagram', 'challenge', 'kevin hart hurricane harvey', 'kevin hart challenge', 'charity', 'donation', 'hurricane harvey relief challenge', 'relief', 'hurricane harvey donation', 'comedian']",0,nVW1gkzCigY
19,Hurricane Harvey: The aftermath - BBC Newsnight,1158129,BBC Newsnight,0,8826,1172,"['bbc', 'newsnight', 'news', 'interview', 'hurricane harvey', 'houston', 'texas', 'flood', 'natural disaster', 'storm']",0,EU6li_fPvfo
20,A Hawk is seeking refuge in my taxi from Hurricane Harvey,1070684,William Bruso,394,3714,57,"['Hurricane Harvey Hawk', 'Meet Princess Pickles!', 'Blackland Prairie Raptor Center', 'Cajun Navy', 'BJ Hookers Vodka', 'Michael Berry Moonshine', 'Redneck Country Club']",0,-6MjdV_8E6Q
21,SURVIVING HURRICANE HARVEY/TORNADO *NO CLICKBAIT*,1066986,Queen Naija,3419,36486,740,"['queen naija', 'Chris and queen', 'queen from Chris and queen', 'vlogs', 'makeup tutorials', 'pranks', 'challenges', 'how to become a youtuber', 'how to', 'try on hauls', 'girly stuff', 'get ready with me', 'GRWM']",0,kSSpN5Sh8go
22,"After Harvey, a Return Home in High Water",999562,The New York Times,2252,6193,541,"['The New York Times', 'NY Times', 'NYT', 'Times Video', 'nytimes.com', 'news', 'newspaper', 'feature', 'reporting', 'Harvey', 'Hurricane Harvey', 'Tropical Storm Harvey', 'Harvey damage', 'hurricane harvey damage', 'homes damaged harvey', 'homes hurricane harvey', 'flooding', 'harvey flooding', 'harvey flood', 'coming home after harvey', 'returning home', 'flooded homes', 'flooded roads', 'houston', 'houston harvey', 'houston flooding', 'houston damage']",0,m9kD3bJa-54
23,Hurricane Harvey: Powerful Storm Hits Texas! Listed as Category 4!,948368,Daily New Hip Hop,490,1342,361,['__UNKNOWN__'],0,hKPjwjHvTMk
24,"Trump Experiences Hurricane Harvey ""First Hand"" - Between the Scenes: The Daily Show",946890,The Daily Show with Trevor Noah,648,17410,250,"['the daily show', 'trevor noah', 'daily show with trevor noah', 'new trevor noah show', 'comedy central politics', 'the daily show episodes', 'Between the Scenes - Trump Experiences Hurricane Harvey', 'late night talk show hosts', 'comedy central', 'stand up comedy', 'comedians', 'comedy central comedians', 'comedy', 'funny', 'comedian', 'funny video', 'comedy videos', 'stand up videos', 'funny jokes', 'funny clips', 'hilarious videos', 'hilarious clips']",0,42hc0T6VWfQ
25,OMG. Houston HURRICANE HARVEY HITS TERRIBLE - TEXAS DISESTAR storm mexico,941369,AMAZING VIDEOS,981,2288,678,"['hurricane harvey', 'hurricane', 'hurricane texas', 'hurricane america', 'disaster', 'storm', 'cnn', 'amazing videos', 'death', 'dead', 'people', 'usa', 'fırtına', 'kaza', 'crash', 'nature', 'mexico hurricane harvey']",0,g5KnnDWXbQU
26,"Houston, Before and After Harvey",909516,The New York Times,718,4160,152,"['Hurricane Harvey', 'Tropical Storm Harvey', 'Harvey', 'Houston', 'Harvey Houston', 'Tropical Storm Houston', 'Hurrican Houston', 'Latest News', 'Houston flooding', 'flooding', 'houston hurricane', 'hurricane harvey houston', 'texas hurricane harvey', 'hurricane harvey death toll', 'tropical storm harvey path', 'weather hurricane harvey', 'hurricane harvey 2017', 'news hurricane harvey', 'hurricane harvey damage', 'Houston Before and After Harvey', 'Before and After', 'Before and After Video', 'New York Times']",0,YzQGgyrxXiI
27,H-E-B Disaster Relief - Hurricane Harvey,839100,H-E-B,8,42,10,"['hurricane', 'harvey', 'disaster relief', 'heb']",0,i60Z0pUbhn0
28,Hurricane Harvey VLOG: Part 1,821726,It's a Buzz World,1311,11063,209,"['Quintuplets', 'quints', 'Busby Quintuplets', 'Busby Quints', 'Busby Family', 'Babies', 'All Girl Quintuplets', 'All girl Quints', 'OutDaughtered', 'Outdaughtered full episodes', ""it's a buzz world"", 'itsabuzzworld', 'Buzz World', 'Buzz Family', 'Adam Busby', 'Danielle Busby', 'TLC', 'Reality TV', 'Identical Twins', 'Twins', 'Triplets', 'Multiples', 'Multiple births', 'Quadruplets', 'Quads', 'Blayke Busby', 'Hazel Grace', 'Hazel Busby', 'Ava Busby', 'Olivia Busby', 'Parker Busby', 'Riley Busby', 'hurricane harvey', 'houston', 'evacuation', 'flooding', 'texas']",0,_0mjwthLiAc
29,Hurricane Harvey approaches Texas coast (STREAMED LIVE),788341,RT,616,2375,341,"['RT', 'Russia Today', 'Hurricane', 'Harvey', 'hurricane Harvey', 'make fall', 'us', 'storm', 'damage', 'weather', 'landing at US coast', 'Hurricane Harvey space view', 'Harvey space', 'ISS', 'International Space Station']",0,4VoL5PMVRfE
30,DID CHRIS AND QUEEN SURVIVE HURRICANE HARVEY? PRAY FOR US,769254,Chris Sails,5162,32611,549,"['chris and queen', 'chrisand queen', 'chris sails', 'queen naija', 'baby cj', 'the sails family', 'pranks', 'challenges', 'vlogs']",0,EhCYlUqX0jM
31,"Diesel Trucks vs Hurricane Harvey, Houston Texas",747384,Badass Diesels Club,1121,5211,360,"['diesel trucks', 'hurricane', 'Houston', 'Texas', 'deep water', 'lifted trucks', 'lifted diesels', 'chevy trucks', 'ford trucks', 'dodge trucks', 'cummins', 'powerstroke', 'duramax', 'chevy save the lives', 'Hurricane Harvey']",0,obYrVrkT9Cc
32,Hurricane Harvey Flooding In The Woodlands Texas 2017,742497,bbew Ecurb,295,1605,213,"['Spring Texas', 'The Woodlands Texas', 'Hurricane Harvey', 'Flooding']",0,QZqZ5ruVCT0
33,"INTENSE eye wall of category 4 Hurricane Harvey from Rockport, TX",714809,AccuWeather,1643,3984,220,"['harvey', 'hurricane', 'category 4', 'rockport', 'Texas', 'video', 'footage']",0,tP5_wav6QZo
34,WHAT Came Out Of Hurricane Harvey? 8/28/17,673127,secureteam10,5334,19641,1124,"['mystery', 'secret', 'alien', 'real', 'moon', 'NASA', 'aliens', 'ufo', 'planet', 'ufos', 'best', 'ovni', 'space', 'secureteam10', 'area 51', 'apollo', 'hologram', 'earth', '2016', 'sun', 'mars', 'strange', 'universe', '2017', 'ocean', 'antarctica', 'tree', 'joe rogan', 'documentary', 'trailer', 'forest', 'saturn', 'news', 'neil degrasse tyson', 'technology', 'future', 'interview']",0,SHXYE7TLkCM
35,CNN's Hurricane Harvey Insanity Off The Charts Crazy!,659249,Mark Dice,7598,37546,1504,"['Hurricane Harvey', 'CNN', 'CNN Hurricane Harvey', 'Hillarious', 'Funny', 'Laughing', 'Television', 'Watching TV', 'CNN Cuts Away', 'CNN Cuts From Hurricane Harvey']",0,hDIQ2BjR2mQ
36,Raw videos of Hurricane Harvey Houston Floods unseen videos #Harvey,638039,MosescxTV,866,2374,447,"['mans cough a fish inside his house in houston', 'houston strong', 'videos of houston destruction', 'floods in houston videos', 'houston airport floodes', 'waters fill with chimicals in houston', 'hombre atrapa pescado en su casa houston', 'Hurricane harvey destructions', 'peope lost everyint in houston', 'people cleanin in houston', 'videos of houston 2017 hurricane', 'texas floodeing before and after videos', 'pray for houston', 'photos of houston floods', 'houstong flooding with water']",0,bgdA5JF_4-Q
37,Hurricane Harvey: Widespread Devastation in One Texas Town | NBC Nightly News,632225,NBC News,1000,1564,194,"['Weather', 'U.S. News', 'Nightly News', 'Hurricane Harvey', 'Texas', 'Rockport', 'Hurricane', 'Damage', 'Harvey', 'Storm', 'Winds', 'Storm Surge']",0,tMGLMOyu6Ow
38,ASMR Hurricane Harvey Help,630358,ASMR Darling,4890,19748,816,"['taylor darling', 'asmr darling', 'tingles']",0,qEtHdZbjo0Q
39,I Sang a Song for Hurricane Harvey Victims,602936,Let Me Explain Studios,9364,37740,638,"['Texas', 'hurricane relief', 'flooding', 'Houston', 'Rockport', 'Harvey', 'donations', 'charity', 'Have I Told You Lately That I Love You', 'Rebecca Parham', 'Let Me Explain Studios', 'help', 'singing', 'song', 'acapella', 'Hurricane Harvey']",0,Ux_gZQsQRvc
40,Massive Gator Takes Shelter On a Bed During Hurricane Harvey,601703,Inside Edition,370,4685,163,"['water', 'flooding', 'Gator Country', 'crocodile', 'texas', 'rescue', 'escape', 'hurricane', 'harvey', 'leigh scheps', 'inside edition', 'Big Al', 'alligator', 'cat-headlines', 'ie animal kingdom']",0,tboWSpfno8A
41,‘Our Town Is Destroyed’: Texans Face Hurricane Harvey Destruction | NBC News,584551,NBC News,1747,2471,265,"['nbc news', 'nbc', 'news', 'news channel', 'news station', 'newspaper', 'breaking news', 'us news', 'world news', 'politics', 'current events', 'top stories', 'pop culture', 'business', 'health', 'Weather', 'U.S. News', 'Digital Original Video', 'Hurricane Harvey', 'Our Town Is Destroyed', 'Texans', 'Face', 'Hurricane', 'Harvey', 'Destruction', 'Hurricane Harvey landed', 'landed in Texas', 'has been marked', 'worst natural disaster', 'Texas history', 'originally category 4 storm', 'left most of southeast Texas', 'underwater', 'Texans facing the storm']",0,WLFCYdgtzUU
42,UPDATE #5 HARVEY THE HURRICANE HAWK!,575923,William Bruso,1452,5602,168,"['Hurricane Harvey Hawk', 'William Bruso', 'Houston Texas', 'Flood 2017', 'Blackland Prairie Raptor Center', 'Plano Texas', 'Lone Star Cab', 'Cajun Navy', 'BJ Hookers Vodka', 'Michael Berry Moonshine', 'Redneck Country Clu']",0,FMAgZULQimc
43,"AFTERMATH: Hurricane Harvey, VISITING MY HOUSE, Michaels House Is Under Water, Houston Flooding, EP1",570722,Blue Ribbon Digital Media,1078,6439,404,"['Hurricane Harvey', 'Hurricane', 'Houston Texas', 'Blue Ribbon Digital Media', 'Michael Melendez', 'Flooding', 'Houston Strong', 'flood water', 'Addicts Reservoir', 'Concord Bridge', 'Bear Creek', 'flooded home', 'aftermath', 'hurricane harvey 2017', 'hurricane harvey video', 'hurricane harvey facts', 'hurricane harvey aftermath', 'texas tornados', 'Home flooded', 'harvey aftermath', 'harvey hurricane', 'houston flood', 'houston before and after', 'flooding in houston', 'Heros', 'People Helping People', 'Michael']",0,0PoMsH85uoY
44,TIME-LAPSE: Hurricane Harvey's destructive path through Texas,553013,kxan,1630,2658,186,"['kxanaustin', 'kxanaustinnews', 'KXAN_News']",0,Dzn309lDKBs
45,CNN caught staging fake rescue of hurricane Harvey victim,548742,DailyWorldwideNews,3271,5363,1066,"['CNN', 'stages', 'fake news', 'hurricane', 'Harvey', 'funny', 'busted', 'caught', 'staged']",0,rvbH_niuoNg
46,"08-26-2017 Rockport, Texas - Hurricane Harvey aerial imagery destruction",543351,Live Storms Media,623,1397,103,"['Hurricane Harvey', 'brian emfinger']",0,GiuJMxrnifI
47,Ellen Surprises High School Students with Biggest Gift Ever,537795,TheEllenShow,0,11999,257,"['ellen', 'ellen degeneres', 'the ellen show', 'ellen fans', 'ellen tickets', 'hurricane Harvey', 'rockport', 'texas', 'plm', 'volleyball', 'ellentube', 'high school', 'students', 'lowes', 'ellen audience', 'season 15', 'season 15 episode 135', 'ellen degeneres show tickets', 'ellen degeneres show today', 'rockport fulton high school', 'rockport fulton high school volleyball', 'pirates', 'gold gym', 'one million dollars', 'rockport texas hurricane', 'heartfelt', 'heartwarming', 'surprise', 'shock', 'heartbreaking', 'survivors', 'be kind', 'inpsiring', 'gift']",0,kRUeIjGn2EA
48,DISASTER OF HURRICANE HARVEY • WRONG SIDE OF YOUTUBE,520880,Cow Chop,1441,22527,165,"['react to', 'reaction', 'youtube movies', 'react', 'review', 'try not to laugh', 'reactions', 'trailer', 'triggered', 'cow chop', 'immortalhd', 'uberhaxornova', 'hurricane harvey', 'houston', 'texas', 'flooding', 'warning', 'boats', 'skis', 'rescue', 'hawk', 'fishing', 'kfc', 'fried chicken', 'reviews']",0,9uN3MdfewLY
49,Incredible Hurricane Harvey Horse Rescue | The Dodo,499573,The Dodo,516,7933,136,"['animal video', 'animals', 'the dodo', 'Rescue', 'Animal Rescue', 'Hurricane Harvey Horse Rescue', 'Hurricane Harvey Horse', 'Harvey Horse Rescue', 'hurricane harvey rescue', 'hurricane harvey damage', 'hurricane harvey flood', 'hurricane harvey horse rescue', 'Horse trapped in flood', 'horse rescue', 'hurricane horse', 'harvey horse', 'hurricane harvey aftermath', 'hurricane harvey animals', 'hurricane harvey galveston', 'hurricane harvey live', 'hurricane harvey video', 'scared horse']",0,AmuKCCVO1t8
50,Joe Rogan on Joel Osteen Closing Church to Hurricane Harvey Victims,496821,Joe Rogan Fan Page,2540,4096,601,"['joe rogan', 'joel osteen', 'huuricane harvey', 'harvey', 'joe rogan joel osteen', 'joe rogan hurricane harvey', 'joel osteen megachurch', 'joel osteen church', 'joe rogan religion', 'news', 'religion', 'interview', 'hurricane harvey news', 'joe rogan news', 'storm', 'cnn', 'fox', 'donald trump', 'trump', 'usa', 'joe rogan podcast', 'jre', 'jre 1004', 'joel osteen harvey', 'joel osteen exposed', 'joe rogan on religion', 'houston', 'hurricane harvey houston', 'houston news']",0,QgLz9BRACj8
51,WE GOT CAUGHT IN HURRICANE HARVEY,496015,Chris Sails,3379,24629,297,"['chris and queen', 'chrisand queen', 'chris sails', 'queen naija', 'baby cj', 'the sails family', 'pranks', 'challenges', 'vlogs']",0,-IyTrmlkgpo
52,The TRUTH About Hurricane Harvey Irma and Lidia - Government HAARP Weather Control WW3,493697,THE RUN GUYS,2199,2882,1423,"['Hurricane Harvey', 'hurricane harvey conspiracy', 'hurricane harvey haarp', 'haarp', 'conspiracy', 'hurricane irma', 'hurricane lida', 'haarp weather control', 'hurricane', 'weather control', 'texas hurricane', 'mexico hurricane', 'hurricane weather control', 'harvey', 'irma', 'ww3', 'Hurricane Lidia', 'Weather modification', 'Weather HAARP', 'Geo Engineering', 'cloud machine', 'Nick Anderson']",0,Xt_7St8kWnU
53,"Lifted Trucks vs Hurricane Harvey, Houston Texas | The Military asked for help from the Rednecks!",486766,Check Engine,508,2826,120,"['diesel trucks', 'lifted trucks', 'Hurricane Harvey', 'Hurricane', 'Harvey', 'Houston', 'Texas', 'deep water', 'lifted dieses', 'chevy trucks', 'dodge trucks', 'rednecks', 'lifted trucks save lives', 'duramax', 'cummins', 'powerstroke', 'ford trucks', 'Military', 'Military trucks']",0,9caRoGFwmy0
54,Busby hurricane Harvey update on Facebook live,468444,It's a Buzz World,1437,8555,154,['__UNKNOWN__'],0,PCpXsZubOLA
55,Waves Break Over Interstate 10 as Tropical Storm Harvey Brings Devastating Flooding to Houston,455747,Storyful Rights Management,160,453,36,"['storyful', 'news', 'viral']",0,rJ7mHjVQtdo
56,Trump Thinks Hurricane Harvey Is All About Him,449892,The Young Turks,4253,7530,2522,"['170828__TA07HurricaneReaction', 'News', 'Politics', 'The Young Turks', 'Cenk Uygur', 'Ana Kasparian', 'TYT', 'progressive', 'liberal', 'news', 'politics', 'hurricane harvey', 'hurricane', 'harvey', 'texas', 'rain', 'floods', 'flooding', 'houston', 'harris county', 'weather', 'storm', 'levees', 'donald trump', 'climate change', 'exxon mobil', 'oil rigs', 'mike pence', 'ted cruz', 'fema', 'emergency', 'disaster', 'natural disaster', 'severe storms', 'severe weather', 'republicans', 'global warming']",0,0hOP-TX06s4
58,Tearful Reunion with pets after Hurricane Harvey,433643,lestersplace,993,6998,143,"['Hurricane', 'Harvey', 'aftermath', 'animals', '#Patystrong']",0,SEu8bJORcX4
57,Hurricane Harvey Flooding in Houston,433546,Exavier Blanchard,44,253,13,"['Hurricane', 'Harvey', 'Houston', 'Flood', 'Flooding', '2017', 'Greens', 'Greenspoint', 'rain', 'Nest', 'timelapse', 'Hurricane Harvey Flooding', 'Greenspoint flooding', 'Houston flooding', 'Hurricane Harvey', 'Tropical Storm Harvey', 'Nest Camera', 'Water', 'Dirty Water', 'Cars underwater']",0,__IBuu06URY
59,Hurricane Harvey Message,417913,The Weather Channel,1517,2376,283,['__UNKNOWN__'],0,k7T_buUdWoM
60,I Just Feel Like Talking- Hurricane Harvey Update #2,391993,grav3yardgirl,3052,17753,525,"['beauty', 'how to', 'makeup', 'howto', 'style', 'fashion', 'summer', 'spring', 'new', 'clothes', 'clothing', 'bunny', '2017', 'hurricane', 'hurricane harvey', 'houston', 'flood']",0,WXqmtGN0Kcg
61,HURRICANE HARVEY CAUSES MASSIVE DESTRUCTION,391531,Elite NWO Agenda,795,1434,213,"['Hurricane', 'Hurrican Harvey', 'Harvey', 'Water', 'dried food', 'canned food', 'prepare', 'prepared', 'storm', 'tropical storm', 'supermarket', 'commodity', 'water storage', 'home', 'life', 'lifestyle', 'family', 'emergency', 'emergency food', 'emergency supplies', 'supplies', 'shopping', 'food', 'water', 'rain', 'rainfall', 'heavy rain', 'driving', 'fuel', 'gas', 'gasoline', 'shops', 'business', '2017', '2018', 'usa', 'texas', 'united states', 'u.s.', 'evacuation', 'waves', 'ocean', 'hot', 'summer', 'summer 2017', 'weather', 'home depot', 'construction', 'repairs', 'roof']",0,DFxT5eLjjyI
62,Ted Cruz talks Hurricane Harvey with MSNBC's Katy Tur,368305,Raw Story,289,172,16,['__UNKNOWN__'],0,iwJg6frfEDU
63,"Hurricane Harvey Eye Wall Extreme Winds, Rockport, TX - 8/25/2017",361635,StormChasingVideo,453,1524,69,"['Rockport', 'TX', 'Hurricane Harvey', 'Harvey', 'hurricane', 'eye wall', 'eye']",0,uuGI3R8BpU8
64,Hurricane Harvey: Health hazards in Houston,359589,Fox News,661,923,116,"['Laura Ingle', 'Digital Originals', 'Disasters', 'Personality', 'Primary Health', 'US', 'Weather', 'Web Exclusives', 'Fox News', 'News']",0,nc3ICtxH3qU
65,Rescued Woman Goes Off On CNN For Hurricane Harvey Coverage VIDEO,352550,The Narrative Times,2435,5459,452,['__UNKNOWN__'],0,ZQnNohhMXNk
66,100% Proof HAARP may have controlled Hurricane Harvey!,344115,The Far Side,1032,1655,303,"['HAARP', 'Hurricane Harvey']",0,SDDPyZKfSYA
