,Title,Views,Channel,Comment Count,Likes,Dislikes,Tags,Favourite Count,Video ID
361,Friday Noon Update on Hurricane Harvey,18296,Levi Cowan,12,187,1,"['weather', 'meteorology', 'tropical', 'tidbits', 'hurricane', 'Levi32', 'Levi', 'Cowan', 'update', 'storm', 'forecast', 'video', 'cyclone', 'atlantic', 'indian', 'pacific', 'ocean', 'caribbean', 'united', 'states']",0,GlsZFoz0bWw
348,Hurricane Harvey Hits Coastal Texas | The New York Times,17902,The New York Times,10,132,8,"['The New York Times', 'NY Times', 'NYT', 'Times Video', 'nytimes.com', 'news', 'newspaper', 'feature', 'reporting', 'Hurricane Harvey', 'hurricane harvey path', 'weather hurricane harvey', 'texas hurricane harvey', 'hurricane harvey 2017', 'hurricane harvey live', 'hurricane harvey update', 'news hurricane harvey', 'hurricane harvey map', 'hurricane harvey corpus christi', 'Corpus Christi', 'videos of hurricane harvey', 'live coverage of hurricane harvey', 'live footage of hurricane harvey', 'flooding']",0,ArjH8fQ7XH8
362,Hurricane Harvey Hits Coastal Texas | The New York Times,17902,The New York Times,10,132,8,"['The New York Times', 'NY Times', 'NYT', 'Times Video', 'nytimes.com', 'news', 'newspaper', 'feature', 'reporting', 'Hurricane Harvey', 'hurricane harvey path', 'weather hurricane harvey', 'texas hurricane harvey', 'hurricane harvey 2017', 'hurricane harvey live', 'hurricane harvey update', 'news hurricane harvey', 'hurricane harvey map', 'hurricane harvey corpus christi', 'Corpus Christi', 'videos of hurricane harvey', 'live coverage of hurricane harvey', 'live footage of hurricane harvey', 'flooding']",0,ArjH8fQ7XH8
363,Dorkly's Hurricane Harvey Relief Charity Stream Part 2,17863,Dorkly,23,419,39,['__UNKNOWN__'],0,CjdNLDcj8DY
364,Hurricane Harvey - Rice University Flooding,17767,Jmiah Covers,5,35,4,"['hurricane harvey', 'hurricane', 'harvey', 'houston', 'texas', 'flooding', 'rain', 'storm', 'floods', 'disaster']",0,WSQmJBKe_AI
349,Hurricane Harvey - Rice University Flooding,17767,Jmiah Covers,5,35,4,"['hurricane harvey', 'hurricane', 'harvey', 'houston', 'texas', 'flooding', 'rain', 'storm', 'floods', 'disaster']",0,WSQmJBKe_AI
365,Toxins From Hurricane Harvey Still Poisoning Houston Residents,17734,The Young Turks,311,538,41,"['mike papantonio', 'farron cousins', 'levinlaw', 'lawyer', 'attorney', 'legal', 'lawsuit', 'environment', 'hurricane Harvey', 'hurricane Irma', 'maria', 'Harvey pollution', 'harevey toxins', 'health', 'water', 'epa', 'scott Pruitt', 'environmental protection agency']",0,d0cU0CwLgUs
366,Houston coming together in the wake of tragedy from Hurricane Harvey | SC Featured | ESPN Stories,17656,ESPN,59,301,11,"['hurrican harvey', 'jeff darlington', 'tragedy', 'jj watt', 'j.j. watt', 'justin james', 'justin james watt', 'hurricane', 'hurricane relief', 'harvey', 'donate', 'donation', 'houston texans', 'texas hurricane', 'heavy rain', 'emergency supplies', 'tropical storm', 'emergency food', 'flooding', 'storm', 'news', 'weather', 'help', 'feature', 'sc featured', 'fundraising efforts', 'devasted', 'devastation', 'relief', 'hurricane harvey relief', 'features', 'sportscenter', 'sc', 'ESPN']",0,iYk1kt4IG_0
367,Pure Again by Rylee Preston  iTunes sales donated to the victims of Hurricane Harvey,17546,Rylee Preston,34,255,14,"['rylee preston', 'soliders light', 'singer', 'soldiers light', 'veterans day video', 'Texas', 'Hurricane Harvey', 'Heroes', 'Storm']",0,6YJnlItlhJQ
368,Hurricane Harvey: 130 mph winds in eye wall to catastrophic flooding in Houston,17473,AccuWeather,16,185,31,"['hurricane', 'harvey', 'houston', 'houston flood', 'rockport', 'Port Lavaca', 'Katy', 'Texas', 'Hurricane Harvey', 'video', 'flood', 'flash flood', 'storm', 'weather', 'storm chase']",0,Td-XGq19IAE
369,"Empire Files: After Hurricane Harvey, Abandoned Community Takes Charge",17243,TeleSUR English,209,883,13,"['politics', 'news', 'US', 'Empire', 'telesur', 'Empire Files', 'Abby Martin', 'News', 'Latin America', 'hurricane', 'hurricane harvey', 'harvey', 'lakewood', 'Texas', 'Houston', 'Houston strong', '77078', 'climate change', 'racism', 'environmental racism', 'documentary', 'Sylvester Turner', 'community organizing', 'hurricane irma', 'hurricane katrina', 'FEMA', 'Trump', 'Red Cross', 'disaster relief', 'housing', 'undocumented', 'rescue', 'flood', 'flooding', 'anarchism', 'storm', 'big oil', 'oil industry', 'volunteers', 'community service', 'Greg Abbott']",0,i_LmCOh-nm8
370,"See where 10,000 people are living after Hurricane Harvey",17108,CNN,127,208,70,"['george r brown', 'houston convention center', 'hurricane', 'hurricane harvey', 'houston floods', 'texas floods', 'floods']",0,5z1MJcp-Cwc
371,Dierks Bentley - Riser (Hurricane Harvey Montage),16948,Bobby Bones,12,164,2,"['bobby bones', 'bobby bones show', 'country', 'country music', 'nashville']",0,2QUWaO3r15w
372,URGENT WHITE HOUSE PRESS BRIEFING HURRICANE HARVEY LIVE STREAM 8/25/17,16891,Right Side Broadcasting Network,39,419,21,"['President Trump', 'Live Stream', 'White House', 'Press Briefing', 'Hurricane Harvey', 'Sarah Sanders']",0,e5_4mwG4Gi4
373,Special Report:  Hurricane Harvey makes landfall in Texas as a Category 4 storm | ABC News,16857,ABC News,70,190,12,"['Texas', 'Hurricane Harvey', 'National Hurricane Center', 'category 4 storm', 'flooding', 'weather', 'abc', 'abcnews']",0,Zo3Wb8LiWFw
374,"Hurricane Harvey's Devastating Flooding in La Grange, Texas",16507,Colton Brugger,0,0,0,['__UNKNOWN__'],0,Zj0XpyFzVlM
375,"Hurricane Harvey Live from Corpus Christi, TX",16477,Joseph Gonzales,10,57,7,['__UNKNOWN__'],0,I6KBAU6ei54
377,Hurricane Harvey Fire Ant Raft,16394,Blue Watts,22,37,2,"['hurricane harvey', 'harvey', 'houston', 'the woodlands', 'fire ants', 'texas', 'hurricane', 'tropical storm harvey', 'tropical storm', 'ants', 'gross', 'texan problems']",0,afM9kdwacfc
376,Hurricane Harvey update 10:30 pm 8_25,16310,KRIS 6 News,2,27,2,['News'],0,V9OyHpJZ9ec
378,WOW! Gospel Songs Breaking Out In A Shelter After Hurricane Harvey!,16006,GREAT Christian Videos!,20,160,2,['YouTube Editor'],0,LrzoW4B_32Y
381,BeatKing - Hurricane Harvey Freestyle,15872,Trap Music,9,272,8,['__UNKNOWN__'],0,X5-br21x5mE
379,"Hurricane Harvey Floods Houston & How You Can Help, Mama Skorpion Surgery Update, & A Lot More",15838,theskorpionshow,243,1427,30,"['The Skorpion Show', 'Kevin and Makael', 'Reality TV', 'Current Events', 'Hurricane Harvey', 'Houston', 'Texas', 'Houston TX', 'Help']",0,KEYUGNH3aSA
380,"Direct Hit from Hurricane Harvey (Refugio, TX) 8/26/2017 ** Extended Version **",15826,Tornado Trackers,25,114,7,"['hurricane', 'harvey', 'flooding', 'wind', 'debris', 'damage']",0,Ge8OneFb6TA
382,Texas shelter dogs arrive in N.J. after Hurricane Harvey,15624,NJ.com,18,91,4,"['nj.com', 'nj', 'new jersey']",0,33fxt9yH7co
383,LIVE: PORT ARTHUR UNDER WATER! Dangerous rescues in Texas -- HURRICANE HARVEY,15606,ABC15 Arizona,7,56,3,"['Hurricane Harvey', 'President Trump', 'Water Rescue', 'Port Arthur', 'Trending', 'ABC15', 'Texas']",0,LgNgKuxCZ2c
385,Meet The Everyday Heroes Who Helped Save Countless Lives During Hurricane Harvey | TODAY,15432,TODAY,19,199,6,"['News', 'Big News', ""Editor's picks"", 'Sunday TODAY', 'Hurricane Harvey']",0,ryRL7O3WZb8
384,🚜🌾Texas Hay Baling after Hurricane Harvey🌀,15430,Hay Map - Buy & Sell Hay,12,73,1,"['Hay Baling', 'Hay Map', 'Hay', 'Tractors', 'John Deere', 'New Holland', 'Bale Baron', 'Square Baler', 'Drone', 'Hurricane Harvey']",0,6I9UPkTJ0vs
387,Hurricane Harvey 518 and I-45 League City TX,14763,Pamela Girlfish,27,28,3,"['Hurricane', 'Harvey', '518', 'and', 'I-45', 'League', 'City', 'TX']",0,C14wqIGn8mk
386,Amazing moment horses are rescued during Hurricane Harvey flooding,14710,Latest News,7,129,2,"['Amazing moment', 'Amazing', 'Amazing moment horses', 'horses', 'rescue', 'Hurricane', 'Hurricane Harvey', 'flood', 'flooding', 'Harvey flooding', 'Hurricane Harvey flooding']",0,9DmtkEO5tWQ
388,Texas's Dickinson struggles in the wake of Hurricane Harvey,14447,Al Jazeera English,35,83,4,"['Tropical Storm Harvey', 'natural disaster', 'United States of America', 'Diane Eastabrook', 'texas', 'package', 'aljazeera', 'Us & Canada', '#HoustonStrong', 'News', 'hurricane harvey', 'harvey deaths', 'us', '5554342359001', 'English', 'AJE', 'houston', 'environment', 'Dickinson', 'Texas', 'al Jazeera', 'youtube', 'harvey death toll']",0,uBv4_Wq5AeM
389,Hurricane Harvey  video - Earth From Space - GOES 16 slow motion,14289,Space Videos,11,235,11,"['astronomy video', 'earth from space', 'hurricane harvey', 'hurricane', 'harvey', '4k video hurricane harvey', 'nasa', 'nasa video', 'slowmotion', 'slow motion']",0,voJ9-LIq1XQ
390,Bonnet | Hurricane Harvey Disaster Relief Donation,14142,Juicy Ink,88,1573,3,"['hurricane harvey', 'houston food bank', 'texasstrong', 'helpforhouston', 'harvey', 'donation']",0,cLZe18va9zc
391,HURRICANE HARVEY CATASTROPHIC FLOODING ⚠️,13936,Right Wing,17,125,11,"['hurricane harvey', 'hurricane flooding', 'texas flooding', 'texas', 'hurricane', 'winds', 'trapped']",0,RayxzrydYdc
394,Port Aransas 4 weeks after Hurricane Harvey hit.,13908,Tigger Travels Site,19,76,2,"['Hurricane', 'Harvey', 'Port Aransas', 'Texas', 'damage', 'recovery']",0,poPsNkm0TUU
392,Hurricane Harvey: Beaumont Flood - Death Toll Rises,13838,WeatherWar101,56,585,18,['__UNKNOWN__'],0,M5ZNloMhWsk
393,Hurricane Harvey update 8 pm 8_25,13795,KRIS 6 News,7,27,2,['__UNKNOWN__'],0,l7wp0_ncx7E
395,Swamp People: Cajun Cartel Sees Hurricane After-Math | 'Texas 911' Premieres Mar. 1 | History,13683,HISTORY,6,78,3,"['history', 'history channel', 'history shows', 'history channel shows', 'swamp people clips', 'swamp people full episodes', 'swamp people season 9', 'cajuns', 'alligator hunting', 'gator hunting', 'swamp people hurricane harvey', 'swamp people lone star rescue', 'swamp people', 'troy landry', 'chase landry', 'jay paul molinere', 'hunting', 'swamp', 'jacob landry', 'season 9', 'full episodes', 'episodes', 'sneak peeks', 'the landrys', 'hunting season', 'swamp people landrys', 'swamp people hurrican devestation']",0,PIFam_wD668
398,"Hurricane Harvey was Engineered as a ""Weather Weapon"" to Allow FEMA To Impose Martial Law?",13388,Mysterious Outpost TV,57,96,15,"['Weather', 'Wars', 'Modification', 'HAARP', 'Fema', 'Conspiracy', 'Hurricane', 'Harvey', 'Hoax', 'Alex jones', 'Mark Dice', 'Geoengineered', 'Geoengineering', 'Government']",0,h0DJYCEmad4
396,Hurricane Harvey - GOD'S Hidden Message & The Joel Osteen Cover up,13386,theghettogospelteam,159,456,31,"['Joel Ostee', 'Hurricane harvey']",0,27QAFVOTVFo
397,Thursday Evening Update on Hurricane Harvey,13380,Levi Cowan,19,174,2,"['weather', 'meteorology', 'tropical', 'tidbits', 'hurricane', 'Levi32', 'Levi', 'Cowan', 'update', 'storm', 'forecast', 'video', 'cyclone', 'atlantic', 'indian', 'pacific', 'ocean', 'caribbean', 'united', 'states']",0,Z492e89XVy8
399,Federal Flood Insurance Made Hurricane Harvey Even Worse | All In | MSNBC,13357,MSNBC,31,147,9,"['All In', 'All In with Chris Hayes', 'Chris Hayes', 'MSNBC', 'MSNBC news', 'MSNBC live', 'MSNBC TV', 'news', 'breaking news', 'current events', 'US news', 'politics', 'politics news', 'political news', 'elections', 'U.S. news', 'Washington DC', 'Hurricane Harvey', 'federal flood insurance', 'Harvey even worse', 'flood insurance made Harvey even worse', 'Storms are natural events', 'man-made disasters', 'Michael Grunwald', 'flooding', 'coastal communities', 'news channel', 'news station', 'newspaper', 'world news', 'top stories']",0,7Iffv-1iWC8
400,Hurricane Harvey: Scientist Explains Climate Change's Role,10163,TYT Politics,171,391,21,"['tyt', 'the young turks', 'tyt politics', 'news', 'politics', 'Jordan Chariton', 'Ben Kirtman', 'University of Miami', 'Hurricane Harvey', 'Houston', 'Texas', 'Hurricane Katrina', 'Hurricane Sandy', 'climate change', 'global warming', 'Al Gore', 'Donald Trump', 'mainstream media', 'sea levels', 'atmosphere', 'temperatures', 'scientists', 'science']",0,cpPJ1DeZlJA
406,GOES-16 Sees Lightning during Hurricane Harvey,10151,NOAASatellites,2,27,1,"['NOAA', 'NOAA Satellites', 'GOES-16', 'GLM', 'Lightning Mapper', 'Harvey', '2017 Hurricane Season']",0,wG6jXYOxKPE
401,Canyon Gate Community Cinco Ranch (Katy TX) Sept 2nd 2017 Hurricane Harvey Flooding,10147,Michael Fry,16,25,0,"['Hurricane Harvey', 'Canyon Gate', 'Katy TX', 'Flooding', 'Grand Lakes Flooding', 'Drone', 'DJI', 'hurricane harvey footage', 'katy', 'houston', 'texas']",0,tA9fb_JCW98
405,Hurricane Harvey Radar,10100,AerisWeather,3,41,2,"['hurricane harvey', 'harvery', 'radar']",0,8ox0DI0D_vg
402,How FEMA is helping Texas during Hurricane Harvey,10092,ABC News,72,52,18,"['FEMA', 'Brock', 'Long', 'search', 'and', 'rescue', 'hurricane', 'Harvey', 'flash', 'flooding', 'high', 'winds', 'eye', 'of', 'storm', 'heavy', 'rain', 'category', 'texas', 'coast', 'system', 'damage', 'abc', 'news', 'gma']",0,2GHkoJ7_cL4
403,Texas Strong: Hurricane Harvey relief concert,10080,13News Now,10,75,5,"['Harvey', 'texas', 'texas strong', 'hurricane relief', 'concert', 'willie nelson', 'tegna', 'edie brickell', 'lyle lovett', 'Nathaniel Rateliff', 'The Night Sweats', 'Ryan Bingham', 'bonnie raitt', 'paul simon', 'Matthew McConaughy', 'Renée Zellweger', 'Luke Wilson', 'james taylor', 'leon bridges', 'Ha*Ash', 'jimmie vaughan', 'houston', 'austin', 'kens', 'country music']",0,DO1I-wuffJE
404,"Hurricane Harvey in Port Aransas, TX, Aug. 26, 2017",10077,Tarun kumar,1,5,1,"['destruction', 'hurrican harvey', 'texas', 'Category 4 hurricane', 'Dawn in Rockport', '#Texas. Landscape is smashed', ""and scrubbed in #Hurricane #HARVEY's wake. A monstrous cyclone"", 'Hurricane Harvey in Port Aransas', 'city manager of Rockport', 'suburb of Cypress', 'a tornado touched down', 'Hurricane', 'Harvey', 'hurricane Harvey', 'make fall', 'us', 'storm', 'damage', 'weather', 'landing at US coast', 'Hurricane Harvey space view', 'Harvey space', 'Port Aransas', 'TX', 'Hurricane Harvey', 'aftermath']",0,ZeNnHZy-wTo
407,AFTERMATH: Hurricane Harvey Flood Houston Texas,9988,Jefe Sincere,2,6,0,"['hurricane harvey', 'celebrity houses flooded', 'houston texas']",0,EBHtUNR6qe0
408,Tim and Charles Clean Up the Restaurant After Hurricane Harvey | Welcome to Sweetie Pie’s | OWN,9775,OWN,4,93,3,"['Oprah', 'Oprah Winfrey', 'Oprah Winfrey Network YouTube', 'Oprah Where Are They Now', 'full episodes', 'Super Soul Sunday', 'Oprah Winfrey Show', 'The Haves and The Have Nots', 'Have and Have Nots', 'If Loving You Is Wrong', 'Iyanla Vanzant', 'Livin Lozada', 'Oprah Life Class', 'how-to', 'season', 'episode', '#sweetiepies', ""Welcome to Sweetie Pie's"", 'sweetie pie', ""sweetie pie's"", 'Zevi Wolmark', 'deontay wilder', 'miss robbie', 'robbie montgomery', 'Clean Up the Restaurant After Hurricane Harvey']",0,4HYgCD4CdFE
409,Mariah Carey | Tribute to Texas from Hurricane Harvey 💙,9457,#TheFandom,33,231,4,"['1993', '2012', '2014', '2015', '2016', 'amazing', 'amazing vocals', 'best vocals mariah live', 'cardi b', 'carey', 'diva', 'elusive chanteuse', 'hero', 'lamb', 'lambily', 'lambs', 'lip sync', 'live', 'mariah', 'mariah carey', 'mariah carey 2016', 'mariah carey hero live 1993', 'mariah carey interview 2017', 'money moves', 'music', 'new cardi b', 'notes', 'official music video', 'songbird', 'vocal crack', 'vocal fail', 'vocals', 'whistle notes', 'whistle tone', 'whistles', 'texas flood', 'hurricane harvey', 'texas hurrican harvey', 'texas hurricane 2017', 'texas', 'taylor']",0,UTTQiSoeZT0
410,FISD Harvey Video,9329,Friendswood ISD,0,50,2,"['friendswood', 'friendswood isd']",0,PQa8_EF1px8
411,Hurricane Harvey Drone Footage in Kingwood Texas,9252,James Brossart,15,63,3,"['hurricane harvey', 'drone footage of hurricane harvey', 'hurricane harvey drone footage', 'drone footage houston flood', 'hurricane harvey flooding', 'radar', 'hurricane harvey footage', 'hurricane harvey update', 'hurricane harvey path', 'houston flooding', 'harvey path', 'hurricane', 'tropical storm Harvey', 'houston', 'aerial footage', 'rescue', 'police', 'kingwood', 'west lake houston']",0,SkXBDOKUB98
412,Hurricane Harvey Cattle Evacuation!!,9212,TexasProud,30,149,4,['__UNKNOWN__'],0,DxEtsLFrnUg
414,HURRICANE HARVEY Winds & Damage in VICTORIA Texas,9086,Aaron Jayjack,23,57,3,"['victoria texas', 'hurricane harvey', 'hurricane 2017', 'victoria', 'hurricane damage', 'hurricane winds', 'damage', 'hurricane', 'wind', 'hurricane harvey damage', 'texas', 'txwx', 'weather', 'storm damage', 'storms', 'severe', 'gas station destroyed', 'storm chasing 2017', 'hurricane destroys building']",0,JCRYfraLIfc
413,Hurricane Harvey,9045,Nabil El Hamdaoui,86,544,3,"['filmmaking', 'cinematography', 'traveling', 'travel', 'travel the world', 'world', 'sony', 'hollywood', 'canon', 'sony fs7', 'sony fs5', 'cinema', 'canon c100', 'canon c300', 'canon c500', 'Sony A7s II', 'A7s II', 'A7s', 'Metabones', 'Christian Guzman', 'Alphalete', 'Ferrari', 'Lamborghini', 'Supercars', 'Exotic cars', 'Supercar', 'Exotic car', 'Adobe', 'Adobe Premiere Pro', 'Adobe After Effects', 'Adobe Photoshop', 'Adobe Illustrator', 'Adobe Master Collection', 'Adobe CC', 'Adobe Creative Cloud', 'Tropical storm', 'Harvey', 'Hurricane Harvey']",0,B2OkGLmpZP0
415,Hurricane Harvey: Fleeing the floods in Houston – BBC Newsnight,8986,BBC Newsnight,0,71,0,"['bbc', 'newsnight', 'news', 'interview', 'Houston', 'Storm Harvey', 'Hurricane Harvey', 'Texas', 'storm', 'evacuation']",0,ZK3lK9uqI_4
418,Christmas comes early for town hit hard by Hurricane Harvey,8766,CBS Evening News,4,82,2,"['video', 'cbs', 'news', 'cbs evening news', 'Christmas', 'Texas Gulf Coast', 'Hurricane Harvey', 'Santa Claus', 'On the Road']",0,uE33Vr4Y4Xs
416,Bayshore Drive Key Allegro Hurricane Harvey Damage,8718,Paul Masters,6,16,0,['hurricane harvey key allegro'],0,85tjzwpRjI0
417,08/24/17 -Hurricane Harvey in the Gulf of Mexico,8635,NWSOPC,0,33,4,['Hurricane Harvey'],0,8tbcPlAg6TQ
419,Scientists link Hurricane Harvey to climate change,8552,Al Jazeera English,78,118,51,"['Tropical Storm Harvey', 'English', 'Andy Gallacher', '5558816932001', 'us floods', 'Homes', 'United States', 'texas flooding', '#HoustonStrong', 'global worming', 'package', 'News', 'harvey', 'natural disasters', 'US state', 'houston storm', 'aljazeera', 'houston', 'texas floods', 'Texas', 'weather', 'houston floods', 'texas homes', 'us displaced', 'al Jazeera', 'youtube', 'texas tropical storm', 'Texas Storm', 'climate change', 'AJE', 'harvey death toll', 'harvey deaths']",0,Sk1VE6d4AE0
420,Drone Footage of Hurricane Harvey Flooding in Kingwood,8224,Jim Miller,8,31,3,"['hurricane', 'harvey', 'flood', 'kingwood', 'texas', 'houston', 'drone', 'mavic', 'mavicpro', 'prayer', 'pray', 'Elijah', 'healing', 'hurting', 'wet', 'water', 'underwater', 'sunken', 'kayak', 'boat', 'jetski', 'launch']",0,V4oNvJS8vFY
423,"Hurricane Harvey song, “Strong” By Dylan Kenny",8179,Dylan Kenny,18,124,0,['__UNKNOWN__'],0,2CRpxNSUWBs
421,"106th Rescue Wing Hurricane Harvey Rescue B-Roll #1 - August 30, 2017",8163,New York Army National Guard,8,63,1,"['New York', 'Air Force', 'National Guard', '106th', 'Rescue Wing', 'Hurricane', 'Harvey', 'Texas']",0,5LiEcXvYE8s
422,Bun B Gives Update on Hurricane Harvey & How You Can Help on Sway in the Morning,8093,Sway's Universe,43,242,8,"['Sway Calloway', 'The Morning Show', 'Sway In The Morning', 'Interview', 'Hip Hop', 'Pop', 'bun b', 'hurricane harvey', 'update']",0,4by1LWTh5PU
424,"Hurricane Harvey flooding in Montrose, Houston, Texas",7788,Jackson Myers,21,30,3,"['hurricane', 'harvey', 'hurricane harvey', 'flooding', 'houston', 'texas', 'usa', 'montrose', 'flood', 'university of st. thomas', 'university', 'west main', 'yoakum']",0,Vfmjujk22JE
425,Rice students thank Rice University Housing and Dining workers during Hurricane Harvey,7607,Rice University,1,56,0,"['Rice University', 'Rice', 'Houston', 'Texas', 'College', 'University', 'Education', 'Students', 'Higher Education']",0,5NYX-x-0KEI
426,Hurricane Harvey Destruction Rockport Texas  Cove Harbor Marina & Drystack Boat Storage,7505,Globaleffect1969,5,16,4,"['Hurricane Harvey', 'Storm', 'Category-4', 'Category 4', 'battered', 'coast', '130', 'mph', 'winds', 'heavy rain', 'Harvey', 'landfall', 'Rockport', 'Texas', 'August 25 2017', '130 mph', 'hurricane', 'united states', '2017', 'august', 'rockport texas', 'destruction', 'category', 'strongest hurricane', 'rain', 'irma', 'hurricane irma']",0,wAUe1Umyuag
427,What it’s like to go home after Hurricane Harvey and realize you’ve lost everything,7453,PBS NewsHour,0,67,5,['__UNKNOWN__'],0,nB2o3bUF9Bg
428,Hurricane Harvey Rescues by Coast Guard and National Guard,7389,US Military Videos,26,141,4,"['Hurricane HArvey', 'Rescues', 'Coast Guard', 'National Guard', 'Flooding']",0,-X8Oufb9XVU
429,"Flying through a Hurricane Harvey Eye wall | Aug 24, 2017",7261,Breaking Disaster,2,13,5,"['weather', 'rain', 'hurricane', 'hurricane harvey', 'disaster', 'gust', 'wind', 'fly']",0,SSjuhyS5Pqk
431,Students Help Victims of Hurricane Harvey Restore Lost Memories | Adobe Creative Cloud,7249,Adobe Creative Cloud,17,186,0,"['Adobe Creative Cloud', 'Creative Cloud', 'Adobe CC', 'Adobe Cloud', 'Adobe creative suite', '#MakeAdobeCC', '#AdobeCC', '#ACCTags', 'photoshop', 'adobe photoshop', 'adobe', 'adobe creative suite', 'photo shop', 'how to', 'use photoshop', 'hurricane', 'houston hurricane', 'hurricane harvey', 'hurricane aftermath', 'photo restoration', 'water damage photo']",0,SeTpdqoVbUo
430,Hurricane Harvey Compilation (Part 2),7182,Aram S,2,72,2,"['Harvey', 'Texas', 'Houston', 'CBP', 'USCG', 'Hurricane', 'Response']",0,OyUoLuIlw78
432,WATCH: White House news briefing ahead of Hurricane Harvey,6975,PBS NewsHour,0,37,21,['__UNKNOWN__'],0,VL1ov4UwpCs
433,The Sacrifice Zones of Hurricane Harvey,6969,Empire Files,72,363,14,"['big oil', 'corruption', 'politics', 'fence line', 'racism', 'environmental justice', 'abby martin', 'empire files', 'documentary', 'interview', 'azzurra crispino', 'dr robert bullard', 'chemical plants', 'corporations', 'arkema', 'pollution', 'cancer clusters', 'zoning', 'jim crow', 'prisoners', 'incarcerated', 'flooding', 'hurricane harvey', 'sacrifice zones', 'houston', 'texas', 'ship yard', 'climate change', 'climate denial', 'capitalism', 'yvette arellano', 'katrina']",0,x-mvl2LAmHA
434,US: Hurricane Harvey leaves Texan cotton growers in despair,6856,Al Jazeera English,24,93,5,"['5567622749001', 'flooding', 'profit', 'cotton', 'texas', 'houston', 'Disaster', 'package', 'agriculture', 'Damages', 'storm', 'News', 'hurricane harvey', 'business', 'crop', 'English', 'Matagorda County', 'al Jazeera', 'farmers', 'youtube', 'money', 'AJE', 'aljazeera', 'billions', 'rain']",0,AuXSgr0uXoo
435,The genesis of Major Hurricane Harvey,6852,NWSCorpus,0,4,0,['Hurricane Harvey'],0,yzzb30VaGBI
436,Hurricane Harvey,6810,Chinedu Ogu,27,261,3,"['Hurricane Harvey', 'Tropical Storm Harvey', 'Harvey', 'comedy', 'Houston', 'Houston Texas', 'Texas', 'Chinedu', 'Chinedu Ogu']",0,d_QeF_-G8t4
437,Hurricane Harvey: Private Jet Missions,6678,Deidox Austin,0,12,2,['__UNKNOWN__'],0,1sB0TWiSGzw
438,Z-Ro - Houston 2gether (audio) Hurricane  Harvey,6654,Juan Rios,8,103,2,['__UNKNOWN__'],0,tLAQXgGzPpk
439,Swamp People: Coy Shares His Hurricane Harvey Damage | 'Texas 911' Premieres Mar. 1 | History,6627,HISTORY,2,35,8,"['history', 'history channel', 'history shows', 'history channel shows', 'swamp people clips', 'swamp people full episodes', 'swamp people season 9', 'cajuns', 'alligator hunting', 'gator hunting', 'troy landry', 'chase landry', 'holden landry', 'swamp people landrys', 'the landrys', 'jay paul molinere', 'archery', 'competition', 'cajun cartel', 'hurricane harvey', 'harvey', 'texas', 'hurricane', 'houston', 'flooding', 'weather', 'storm', 'climate change', 'natural disaster', 'houston texas', 'hurricane harvey damage', 'hurricane harvey texas']",0,kQjfmP1g5hg
440,Beyonce: Halo - Hurricane Harvey Rescue and Relief Texas Tribute,6511,riskhappy,7,77,2,"['hurricane harvey', 'harvey', 'houston', 'corpus christi', 'rockport', 'aransas pass', 'port aransas', 'port arthur', 'rescue', 'coast guard', 'pray for texas', 'beyonce', 'halo']",0,OknS3wB9fG4
442,PepsiCo Provides Hurricane Harvey Relief - 1 Million Meals,6358,PepsiCo,4,13,11,"['Hurricane Harvey', 'Relief', 'Disaster', 'PepsiCo', 'Food for Good', 'Salvation Army', 'Red Cross', 'Feeding America', 'Texas', 'Houston', 'Community', 'Donations', 'Greater Texas', 'Meals']",0,gFaE7y9U3SI
441,Houston Hurricane Harvey - Through The Rain,6315,Free Hugs Project,47,343,2,"['Motivational Videos', 'Inspirational Videos', 'Uplifting Videos', 'Heartwarming Videos', 'Random Acts of Kindness', 'Restore Faith In Humanity', 'Pay It Forward', 'Positive Videos', 'Happy Videos', 'Protest Videos', 'Free Hugs Project', 'Ken Nwadike Jr', 'Change The World', 'Motivational Speeches', 'Motivational Speakers', 'Youth Motivational Speaker', 'Motivational Speaker for High Schools and Colleges', 'Fight Videos', 'Houston', 'Hurricane Harvey', 'Hurricanes']",0,zF4PxoVTFgY
443,Hurricane Harvey & Weather Modification Techniques - Weather Channel Now IBM Business,6220,Leak Project,104,170,5,"['Hurricane', 'Harvey', 'Weather', 'Modification', 'IBM', 'Buys', 'Channel', 'Latest', 'On', 'Scene']",0,vY5FzNoQ3PE
445,HURRICANE #HARVEY AFTERMATH - HOMES DESTROYED IN THE HOUSTON FLOOD | TexasGirly1979,6190,TexasGirly1979,71,102,9,"['funny', 'cute', 'pets', 'cat', 'roomba', 'catroomba', 'cat on roomba', 'dogs', 'cute pets', 'LOL', 'lol comedy', 'HURRICANE #HARVEY AFTERMATH - HOMES DESTROYED IN THE HOUSTON FLOOD', 'HURRICANE HARVEY SURVIVORS GUILT']",0,LWPAR7w-uKk
444,Hurricane Harvey Cloud Seeding Explained & USDA Electrified Water Experiment,6170,Jim Lee,99,226,7,"['climateviewer', '#hangoutsonair', 'Hangouts On Air', '#hoa']",0,GvlUHX2dQDc
