id,date,time,timezone,user_id,username,tweet,replies,retweets,likes,location,hashtags,link
30360463510347776,2011-01-26,20:24:33,UTC,243323660,HerefordSnooker,BBC News - Hurricane Alex Higgins' scrawled notes sold at auction  http://www.bbc.co.uk/news/uk-northern-ireland-12214471,0,0,0,,[],https://twitter.com/HerefordSnooker/status/30360463510347776/
30328991172792320,2011-01-26,18:19:29,UTC,25830750,homemadebeer,Hurricane Alex Beer Tasting - Banks's Mild Ale also Coopers Selection Wheat Beer  http://bit.ly/heo6tX,0,0,0,,[],https://twitter.com/homemadebeer/status/30328991172792320/
29964883399282688,2011-01-25,18:12:39,UTC,71567114,AndersonCale,"I favorited a YouTube video -- Hurricane Alex - Cat 2 June, 30th 2010 Compilation  http://youtu.be/6kZ-S4yoHLM?a",0,0,0,,[],https://twitter.com/AndersonCale/status/29964883399282688/
29677319262052354,2011-01-24,23:09:58,UTC,190426755,hq180,Hurricane Alex Higgins' scrawled notes sold at auction #snooker  http://bbc.in/fM8SjM,0,0,0,,['#snooker'],https://twitter.com/hq180/status/29677319262052354/
29352342444843008,2011-01-23,01:38:38,UTC,136274193,Pietros1,Hurricane Alex Higgins' scrawled notes sold at auction: http://www.bbc.co.uk/news/mobile/uk-northern-ireland-12214471,0,0,0,,[],https://twitter.com/Pietros1/status/29352342444843008/
28154211724169216,2011-01-20,18:17:41,UTC,211684351,enalyozone,Hurricane Alex Picks Up Momentum as it Bears Down on Northeast Mexico and the Southern Tip of Texas  http://nblo.gs/dfH4a,0,0,0,,[],https://twitter.com/enalyozone/status/28154211724169216/
27826971715051520,2011-01-19,20:37:21,UTC,134758426,icentreonline,BBC News - Hurricane Alex Higgins' scrawled notes up for auction  http://www.bbc.co.uk/news/uk-northern-ireland-12214471,0,0,0,,[],https://twitter.com/icentreonline/status/27826971715051520/
27823877832835072,2011-01-19,20:25:04,UTC,125341381,Top7sports,Hurricane Alex Higgins' scrawled notes up for auction (who's buying?) -  http://ow.ly/3GoKx,0,0,0,,[],https://twitter.com/Top7sports/status/27823877832835072/
27754921877045248,2011-01-19,15:51:03,UTC,175139115,PeterMcCay,Hurricane Alex Higgins' scrawled notes up for auction:  http://bbc.in/hKA48E via @addthis #godblessualex,0,0,0,,['#godblessualex'],https://twitter.com/PeterMcCay/status/27754921877045248/
27724018979184640,2011-01-19,13:48:15,UTC,14055229,tombrookspolloc,RT @MENnewsdesk Betting slip insights into the mind of 'Hurricane' Alex Higgins  http://ow.ly/1aVKyx,0,0,0,,[],https://twitter.com/tombrookspolloc/status/27724018979184640/
27657732202962945,2011-01-19,09:24:51,UTC,20678866,MENnewsdesk,Betting slip insights into the mind of 'Hurricane' Alex Higgins  http://ow.ly/1aVKyx,0,1,0,,[],https://twitter.com/MENnewsdesk/status/27657732202962945/
27652176868278272,2011-01-19,09:02:47,UTC,104992782,Manchesterwire,Betting slip insights into the mind of 'Hurricane' Alex... -  http://fwix.com/a/97_a801fc1fc4,0,0,0,,[],https://twitter.com/Manchesterwire/status/27652176868278272/
27649025100488704,2011-01-19,08:50:15,UTC,59419236,thisisbolton,Betting slip insights into the mind of 'Hurricane' Alex Higgins: A collection of notes written on betting slips ...  http://bit.ly/gWZzWq,0,0,0,,[],https://twitter.com/thisisbolton/status/27649025100488704/
27649019589173249,2011-01-19,08:50:14,UTC,75648433,manchestersnews,Manchester News: Betting slip insights into the mind of 'Hurricane' Alex Higgins  http://bit.ly/gDeIoD,0,0,0,,[],https://twitter.com/manchestersnews/status/27649019589173249/
27649018859360256,2011-01-19,08:50:14,UTC,72825786,news_manchester,Betting slip insights into the mind of 'Hurricane' Alex Higgins  http://bit.ly/gXwDje,0,0,0,,[],https://twitter.com/news_manchester/status/27649018859360256/
27518779940409344,2011-01-18,00:12:43,UTC,168597160,pensheik,BBC News - Hurricane Alex Higgins' scrawled notes up for auction  http://www.bbc.co.uk/news/uk-northern-ireland-12214471 history notes,0,0,0,,[],https://twitter.com/pensheik/status/27518779940409344/
27341635293552641,2011-01-18,12:28:48,UTC,38867154,betipedia,BBC News - Hurricane Alex Higgins' scrawled notes up for auction  http://bbc.in/hpuIxm,0,0,0,,[],https://twitter.com/betipedia/status/27341635293552641/
27050280096890881,2011-01-17,17:11:04,UTC,37799036,South_Padre,ஜ Hurricane Alex South Padre Island coming ashore #SoPadre #Padre #Island #SPI #TX #Beach #Travel  http://bit.ly/ekKOka,0,0,0,,"['#SoPadre', '#Padre', '#Island', '#SPI', '#TX', '#Beach', '#Travel']",https://twitter.com/South_Padre/status/27050280096890881/
26751597816061952,2011-01-16,21:24:12,UTC,11313922,_Colas,"Self-Portraits of ""Hurricane Alex"" >  http://bit.ly/dFFbEO",0,0,0,,[],https://twitter.com/_Colas/status/26751597816061952/
26669172763131904,2011-01-16,15:56:40,UTC,21800743,iheartmyart,"Photo: Alex Stoddard, Hurricane alex, 2010  http://tumblr.com/x4i19y4ea9",0,0,0,,[],https://twitter.com/iheartmyart/status/26669172763131904/
25320254154481664,2011-01-12,22:36:33,UTC,8348782,alexcalic,It'll be tough to outdo my 2010 fame as I had both a hurricane (Alex) and top-10 song (Alejandro) named after me. Maybe a planet this year?,0,0,0,,[],https://twitter.com/alexcalic/status/25320254154481664/
25212892114583552,2011-01-12,15:29:56,UTC,14436386,AngeloTRobinson,Self-Portraits of “Hurricane Alex” — Illusion 360 -   http://illusion.scene360.com/art/14654/self-portraits-of-hurricane-alex/ … via @Scene360,0,0,0,,[],https://twitter.com/AngeloTRobinson/status/25212892114583552/
25191675450105856,2011-01-12,14:05:38,UTC,166623973,RoofTop_Roofing,Self-Portraits of “Hurricane Alex” — Illusion 360 - The World's ...: The illusion project hig...  http://bit.ly/i8rxhJ rooftoproofing.com,0,0,0,,[],https://twitter.com/RoofTop_Roofing/status/25191675450105856/
25155362680217600,2011-01-12,11:41:20,UTC,183323886,2leepcom,Self-Portraits of “Hurricane Alex”  http://2leep.com/news/121406/,0,0,0,,[],https://twitter.com/2leepcom/status/25155362680217600/
24865454287757312,2011-01-11,16:29:20,UTC,47719798,artevital,"Self-Portraits of ""Hurricane Alex"" - Only seventeen years old, photographer Alex Stoddard already has a brilliant se...  http://ow.ly/1aOX3N",0,0,0,,[],https://twitter.com/artevital/status/24865454287757312/
24854789149954049,2011-01-11,15:46:58,UTC,49107838,betsayyapple,Photo: Hurricane alex. (by alexstoddard)  http://tumblr.com/xhg18mrwgd,0,0,0,,[],https://twitter.com/betsayyapple/status/24854789149954049/
24850639771144192,2011-01-11,15:30:28,UTC,16270319,denardhenry,"#inter_web digg'n » Self-Portraits of “Hurricane Alex” - Only seventeen years old, photographer Alex Stoddard alread...  http://ow.ly/1aOU1n",0,0,0,,['#inter_web'],https://twitter.com/denardhenry/status/24850639771144192/
24850298040229888,2011-01-11,15:29:07,UTC,47719798,artevital,"Self-Portraits of ""Hurricane Alex"" - Only seventeen years old, photographer Alex Stoddard already has a brilliant se...  http://ow.ly/1aOUqj",0,0,0,,[],https://twitter.com/artevital/status/24850298040229888/
24850297717268480,2011-01-11,15:29:07,UTC,141719661,marieladinardo,"Self-Portraits of ""Hurricane Alex"" - Only seventeen years old, photographer Alex Stoddard already has a brilliant se...  http://ow.ly/1aOUqk",0,0,0,,[],https://twitter.com/marieladinardo/status/24850297717268480/
24843554895437824,2011-01-11,15:02:19,UTC,19896981,543news,"「360影片」 Self-Portraits of “Hurricane Alex”: Only seventeen years old, photographer Alex Stoddard already has a ...  http://bit.ly/gcOvX5",0,0,0,,[],https://twitter.com/543news/status/24843554895437824/
24843263307423744,2011-01-11,15:01:10,UTC,15308884,Scene360,"Illusion: Self-Portraits of ""Hurricane Alex""  http://bit.ly/ikdDU7",0,2,0,,[],https://twitter.com/Scene360/status/24843263307423744/
24663370183483392,2011-01-10,03:06:20,UTC,120789433,AzkPortnoy,"@DTRobert @iheartportnoy beckys situation reminded me to hurricane alex, right bro?",0,0,0,,[],https://twitter.com/AzkPortnoy/status/24663370183483392/
24552823077216257,2011-01-10,19:47:03,UTC,10599452,CanesCast,Lethbridge Hurricane Alex Kuvaev ranked 106 in the CSS mid-term draft rankings. #WHL #WHLCanes,0,1,0,,"['#WHL', '#WHLCanes']",https://twitter.com/CanesCast/status/24552823077216257/
24531664252174336,2011-01-10,18:22:59,UTC,58037224,Thomasbrodin,Hurricane alex. (by alexstoddard)  http://tumblr.com/xkc18f9j98,0,0,0,,[],https://twitter.com/Thomasbrodin/status/24531664252174336/
23888247193079809,2011-01-08,23:46:16,UTC,18537723,thenotoriousmlp,@electricsoup Hurricane Alex?,0,0,0,,[],https://twitter.com/thenotoriousmlp/status/23888247193079809/
23797945761538048,2011-01-08,17:47:27,UTC,232999166,urhajos,Photo: Hurricane alex. (by alexstoddard)  http://tumblr.com/xvy17w4ro2,0,0,0,,[],https://twitter.com/urhajos/status/23797945761538048/
23367999176048640,2011-01-07,13:18:59,UTC,125502345,Localcorpus,Farmers eligible for Hurricane Alex loans -  http://fwix.com/a/78_ede18e9c3a,0,0,0,,[],https://twitter.com/Localcorpus/status/23367999176048640/
23140822027337728,2011-01-06,22:16:16,UTC,166623973,RoofTop_Roofing,Farmers eligible for Hurricane Alex loans: By Mark Collette CORPUS CHRISTI — Farmers who lost...  http://bit.ly/gbBq5e rooftoproofing.com,0,0,0,,[],https://twitter.com/RoofTop_Roofing/status/23140822027337728/
23140817329721345,2011-01-06,22:16:15,UTC,27465398,tankovic,Farmers eligible for Hurricane Alex loans  http://bit.ly/hclfUW,0,0,0,,[],https://twitter.com/tankovic/status/23140817329721345/
23057073143029760,2011-01-06,16:43:29,UTC,39697114,whatchawearing,Hey @GulfsterReport I found a Florida West coast Surf Video  http://www.thewhatchawearing.com/whatchawearing.html Hurricane Alex,0,0,0,,[],https://twitter.com/whatchawearing/status/23057073143029760/
22761282683801600,2011-01-05,21:08:07,UTC,205796461,thetruthczarcom,Hurricane Alex Stalls Area Efforts To Rid Gulf Coast Of Spilled Oil -  http://tinyurl.com/35fuedf,0,0,0,,[],https://twitter.com/thetruthczarcom/status/22761282683801600/
22181630013612032,2011-01-03,06:44:47,UTC,166623973,RoofTop_Roofing,A rough road ahead: By Lara K. Richards Flooding caused by the remnants of Hurricane Alex in ...  http://bit.ly/eBa5Pi rooftoproofing.com,0,0,0,,[],https://twitter.com/RoofTop_Roofing/status/22181630013612032/
21106646646263810,2010-12-31,07:33:11,UTC,153936832,GulfOilSpills,Nice Alex Hurricane photos-Hurricane Alex Delays BP Oil Spill ...: Recently upgraded from a Tropical Storm to a ...  http://bit.ly/ieXwHA,0,0,0,,[],https://twitter.com/GulfOilSpills/status/21106646646263810/
21059788464988160,2010-12-31,04:26:59,UTC,153936832,GulfOilSpills,Nice Alex Hurricane photos-Hurricane Alex Delays BP Oil Spill ...: According to BP's manager of skimming operati...  http://bit.ly/fbIbB7,0,0,0,,[],https://twitter.com/GulfOilSpills/status/21059788464988160/
21017526372663297,2010-12-31,01:39:03,UTC,226691191,TripTrundle,@weather_news_ RT @WEATHER_NEWS_ Weather Nice Alex Hurricane photos-Hurricane Alex Delays BP Oil Spill Clean-Up Efforts In Gulf...  http://bit.ly/gNFDen,0,0,0,,[],https://twitter.com/TripTrundle/status/21017526372663297/
21009724807839744,2010-12-31,01:08:03,UTC,162400759,A_Lot_Happening,Weather Nice Alex Hurricane photos-Hurricane Alex Delays BP Oil Spill Clean-Up Efforts In Gulf Coast  : Check ou...  http://bit.ly/h3Xipj,0,0,0,,[],https://twitter.com/A_Lot_Happening/status/21009724807839744/
21007798556958721,2010-12-31,01:00:24,UTC,122957087,HAPPENINGS1NOW,Post: Nice Alex Hurricane photos-Hurricane Alex Delays BP Oil Spill Clean-Up Efforts In Gulf Coast    http://bit.ly/hlk0mr,0,0,0,,[],https://twitter.com/HAPPENINGS1NOW/status/21007798556958721/
20663692924297216,2010-12-30,02:13:02,UTC,224362254,scottmcpartland,@ExtremeStorms @weatherzine That's a great picture! Looks like Hurricane Alex had some punch to him.  http://twitpic.com/3ldi27,0,0,0,,[],https://twitter.com/scottmcpartland/status/20663692924297216/
20662516648513537,2010-12-30,02:08:22,UTC,26930438,ExtremeStorms,"@JimCantore @weatherzine Hurricane Alex, South Padre Island, TX just down the street from you :)",0,0,0,,[],https://twitter.com/ExtremeStorms/status/20662516648513537/
20409311750529024,2010-12-30,09:22:13,UTC,162400759,A_Lot_Happening,Weather Ready for Hurricane Alex-Miami Hurricanes College Football Tickets and Seating Chart: Check out these al...  http://bit.ly/er7ihh,0,0,0,,[],https://twitter.com/A_Lot_Happening/status/20409311750529024/
20403827245064192,2010-12-30,09:00:26,UTC,122957087,HAPPENINGS1NOW,Post: Ready for Hurricane Alex-Miami Hurricanes College Football Tickets and Seating Chart  http://bit.ly/fckI6o,0,0,0,,[],https://twitter.com/HAPPENINGS1NOW/status/20403827245064192/
20283553434566656,2010-12-29,01:02:30,UTC,124920689,konosonoff,Halfway Through 2010   NashvilleWX ;)  http://bit.ly/cYfWmF hurricane alex,0,0,0,,[],https://twitter.com/konosonoff/status/20283553434566656/
19862800067203072,2010-12-28,21:10:35,UTC,154771002,saigeysaige,"AND due to ""random ass"" Hurricane Alex, i ALMOST missed the Eclipse premiere. Another part of #2010memories",0,0,0,,['#2010memories'],https://twitter.com/saigeysaige/status/19862800067203072/
19862440598577152,2010-12-28,21:09:09,UTC,37565187,myrhandaaa,Missing warped tour because of it!! RT @n_ryan21: Random ass hurricane Alex #2010memories,0,0,0,,['#2010memories'],https://twitter.com/myrhandaaa/status/19862440598577152/
19659378109972480,2010-12-27,07:42:15,UTC,102592358,MelissaElll,"#2010memories Warped Tour in Hurricane Alex. AH, my phone fried but I've gotta say that was the best concert of the year. Pure muddy fun!",0,0,0,,['#2010memories'],https://twitter.com/MelissaElll/status/19659378109972480/
17989913588801536,2010-12-23,17:08:24,UTC,80892380,aarn08,@TIWWH 6 days! In my city there was this hurricane alex just 3 days... It destroyed a lot of roads lol!,0,0,0,,[],https://twitter.com/aarn08/status/17989913588801536/
17109657919164416,2010-12-20,06:50:34,UTC,224535677,technewsline,@addthis Hurricane Alex Hampers BP's Oil Collection Efforts Drastically  http://www.timesnewsline.com/news/Hurricane-Alex-Hampers-BPs-Oil-Collection-Efforts-Drastically-1277990738/ … via @AddThis,0,0,0,,[],https://twitter.com/technewsline/status/17109657919164416/
16740278517899264,2010-12-19,06:22:48,UTC,17632773,mantix_one,"@_soulkhan what is, ""ali and hurricane""? alex?",0,0,0,,[],https://twitter.com/mantix_one/status/16740278517899264/
15287120906166272,2010-12-15,06:08:28,UTC,78608229,DisasterCentral,"74-year-old lives in house damaged by hurricane: “When the 'chubasco' (Hurricane Alex) hit us, the plastic cover...  http://bit.ly/dQsM7q",0,0,0,,[],https://twitter.com/DisasterCentral/status/15287120906166272/
15250181549195265,2010-12-15,03:41:41,UTC,178111796,oceansidehotel,mailcome: mailcome: Hurricane Alex Impacts <b>Travel</b>  http://goo.gl/fb/VOvra…  http://goo.gl/fb/vAN3A,0,0,0,,[],https://twitter.com/oceansidehotel/status/15250181549195265/
15250149756375040,2010-12-15,03:41:33,UTC,178111796,oceansidehotel,mailcome: Hurricane Alex Impacts <b>Travel</b>  http://goo.gl/fb/VOvra  http://goo.gl/fb/xLkxO,0,0,0,,[],https://twitter.com/oceansidehotel/status/15250149756375040/
15248050695970817,2010-12-15,03:33:13,UTC,178111796,oceansidehotel,Hurricane Alex Impacts <b>Travel</b>  http://goo.gl/fb/VOvra,0,0,0,,[],https://twitter.com/oceansidehotel/status/15248050695970817/
13871485563183105,2010-12-12,08:23:14,UTC,175455589,TrueVows,#wedding #romance Hurricane Alex makes landfall as Category 2 - msnbc.com  http://on.msnbc.com/fvl2S1,0,0,0,,"['#wedding', '#romance']",https://twitter.com/TrueVows/status/13871485563183105/
13613852964954112,2010-12-11,15:19:30,UTC,215394294,Zenzibudalounge,"Our tribute to ""The Hurricane"" - Alex Higgins only Zenzibu Da Sky Bizarre The world of snooker has produced many...  http://fb.me/I00D9vLi",0,0,0,,[],https://twitter.com/Zenzibudalounge/status/13613852964954112/
13286993777655808,2010-12-10,17:40:40,UTC,57716723,bumbled101,@YouTube -- Tracking Hurricane Alex's Toxic Oil Surge  http://www.youtube.com/watch?v=Q0HaYB0-T5E … via @youtube,0,0,0,,[],https://twitter.com/bumbled101/status/13286993777655808/
13277536481976320,2010-12-10,17:03:06,UTC,124594631,rbtshadd,hurricane alex Halfway Through 2010   NashvilleWX :O  http://bit.ly/cYfWmF,0,0,0,,[],https://twitter.com/rbtshadd/status/13277536481976320/
12936769733394432,2010-12-09,18:29:00,UTC,162970020,GMO875,#nytchat in Monterrey Mx after a hurricane Alex some towns choose increasing Property Tax,0,0,0,,['#nytchat'],https://twitter.com/GMO875/status/12936769733394432/
12770071482994688,2010-12-08,07:26:36,UTC,92276218,Mtranscription,DSHS Offers Health-Related Precautions Following Hurricane Alex  Hepatology Transcription Service,0,0,0,,[],https://twitter.com/Mtranscription/status/12770071482994688/
12586856348647424,2010-12-08,19:18:35,UTC,116862260,pscars,Hurricane Alex delays Ford Fiesta deliveries | PSCars:  http://bit.ly/hm4B3S via @addthis,0,0,0,,[],https://twitter.com/pscars/status/12586856348647424/
11881083545059328,2010-12-06,20:34:05,UTC,178563889,magibox,Alex Megane - Hurricane: Alex Megane - Hurricane  http://bit.ly/gO1xWv,0,0,0,,[],https://twitter.com/magibox/status/11881083545059328/
11808798377246720,2010-12-06,15:46:51,UTC,16573230,sleepnclass,DAMN! pandora got a GORL box wetter then hurricane alex. They just played prayer by disturbed and the red by chevelle,0,0,0,,[],https://twitter.com/sleepnclass/status/11808798377246720/
11465940608753664,2010-12-05,17:04:27,UTC,17477775,SergioChapa,Damages from Hurricane Alex still remain on Reynosa side of Hidalgo bridge 5 months later #reynosa #rgv  http://twitpic.com/3d80pt,0,1,0,,"['#reynosa', '#rgv']",https://twitter.com/SergioChapa/status/11465940608753664/
11224764358074368,2010-12-04,01:06:07,UTC,177329586,billweckos,Daily Kos: 2010 Hurricane Season Recap (w/ Awesome Vid): Hurricane Alex June 25 through July 2 110 MPH - Categor...  http://bit.ly/gS0rV4,0,0,0,,[],https://twitter.com/billweckos/status/11224764358074368/
11020601959387136,2010-12-04,11:34:50,UTC,147825763,cookingvideoorg,watch Cookis : Hurricane Alex Beer - filtering of rain water - Some Guitar & Singin 'by Me  http://bit.ly/gA3bx3 #cooking #recipes #food,0,0,0,,"['#cooking', '#recipes', '#food']",https://twitter.com/cookingvideoorg/status/11020601959387136/
10644449478574080,2010-12-03,10:40:09,UTC,40131719,AdmiralMFK,"Marry Regina Lasko, Fuck Hurricane Alex, Kill Danica Mckellar  http://bit.ly/hWEZKg",0,0,0,,[],https://twitter.com/AdmiralMFK/status/10644449478574080/
10151481915211777,2010-12-01,02:01:16,UTC,177329586,billweckos,A reason for thanks?: Hurricane Alex made landfall as a Category 2 storm just south of the Mexican/US border. In...  http://bit.ly/dLUcUX,0,0,0,,[],https://twitter.com/billweckos/status/10151481915211777/
9590049603592192,2010-11-30,12:50:20,UTC,78608229,DisasterCentral,US had shields up to spare it from hurricanes: Hurricane Alex: It was the most powerful hurricane during the mon...  http://bit.ly/fJ0HeN,0,0,0,,[],https://twitter.com/DisasterCentral/status/9590049603592192/
9590042305503232,2010-11-30,12:50:18,UTC,166623973,RoofTop_Roofing,US had shields up to spare it from hurricanes: Hurricane Alex: It was the most powerful hurri...  http://bit.ly/fc9Ojz rooftoproofing.com,0,0,0,,[],https://twitter.com/RoofTop_Roofing/status/9590042305503232/
9276120436310016,2010-11-29,16:02:54,UTC,176809454,fredjs,Damn construction sites and damn hurricane alex hahaha,0,0,0,,[],https://twitter.com/fredjs/status/9276120436310016/
9058033816567808,2010-11-28,01:36:18,UTC,53779813,alexannosaurus,@katystevisonn Really?! At Houston we had Hurricane Alex at Warped Tour. And we all manged to have all the bands played! Lol.,0,0,0,,[],https://twitter.com/alexannosaurus/status/9058033816567808/
8452038555860992,2010-11-27,09:28:17,UTC,55020848,publishpd,Can't Stop The Bleeding » Rock You Like The Hurricane : Alex ...  http://bit.ly/e6SDTO,0,0,0,,[],https://twitter.com/publishpd/status/8452038555860992/
8424240437006337,2010-11-26,07:37:50,UTC,27465398,tankovic,Can't Stop The Bleeding » Rock You Like The Hurricane : Alex ...  http://bit.ly/hc74Ph,0,0,0,,[],https://twitter.com/tankovic/status/8424240437006337/
8379462571790336,2010-11-26,04:39:54,UTC,21718601,AndrewBucholtz,This is great. RT @cstbtweet: New at CSTB : Rock You Like The Hurricane : Alex Higgins' Spectacular Kiss-Off  http://bit.ly/dVue1W,0,0,0,,[],https://twitter.com/AndrewBucholtz/status/8379462571790336/
8379157431980032,2010-11-26,04:38:41,UTC,21532475,cstbtweet,New at CSTB : Rock You Like The Hurricane : Alex Higgins' Spectacular Kiss-Off  http://bit.ly/dVue1W,0,0,0,,[],https://twitter.com/cstbtweet/status/8379157431980032/
7883263196528640,2010-11-25,19:48:11,UTC,177329586,billweckos,"STORM2K • View topic - Is Hurricane Alex The Strongest Category 2 ...: Well anyways, I am wondering whether this...  http://bit.ly/gFaQNZ",0,0,0,,[],https://twitter.com/billweckos/status/7883263196528640/
7352732100853760,2010-11-24,08:40:02,UTC,210708476,athornforeveryh,I call it hurricane Alex. #damncowlicks  http://yfrog.com/myxjk0j,0,0,0,,['#damncowlicks'],https://twitter.com/athornforeveryh/status/7352732100853760/
6797702847270912,2010-11-22,19:54:33,UTC,202889197,ShhhSunshine,@HurricaneAlex me and @BreahteCaraline just had a whole conversation about you lol... Any thoughts? ;D,0,0,0,,[],https://twitter.com/ShhhSunshine/status/6797702847270912/
5794421723373568,2010-11-19,01:27:52,UTC,91848531,greenexoticcar,Hurricane Alex spins past oil rigs toward Mexico  http://sns.ly/Z2M68  -- #oil,0,0,0,,['#oil'],https://twitter.com/greenexoticcar/status/5794421723373568/
5763084010389505,2010-11-19,23:23:20,UTC,202889197,ShhhSunshine,@HurricaneAlex MEEE TOOOOOOOOOO #deathlyhallows for the winnn!!!!!!!,0,0,0,,['#deathlyhallows'],https://twitter.com/ShhhSunshine/status/5763084010389505/
5637813655576576,2010-11-19,15:05:34,UTC,177904774,laurelgle12," http://forum.gspd.ru/member.php?u=126372 Houston may see Hurricane Alex yet, the following hardly any days will tell. However whether it's A",0,0,0,,[],https://twitter.com/laurelgle12/status/5637813655576576/
5160769444380672,2010-11-17,07:29:57,UTC,162400759,A_Lot_Happening,Weather Hurricane Alex Rumbles Toward Texas’ Coast: Hurricane Alex churned westward through the Gulf of Mexico e...  http://bit.ly/cpwEe6,0,0,0,,[],https://twitter.com/A_Lot_Happening/status/5160769444380672/
5002402243551233,2010-11-17,21:00:40,UTC,124786687,bluedeed,hurricane alex Halfway Through 2010   NashvilleWX .  http://bit.ly/cYfWmF,0,0,0,,[],https://twitter.com/bluedeed/status/5002402243551233/
4731010419793920,2010-11-16,03:02:15,UTC,202889197,ShhhSunshine,I love making bad jokes about justin bieber with @HurricaneAlex   :D,0,0,0,,[],https://twitter.com/ShhhSunshine/status/4731010419793920/
4014648336588800,2010-11-14,03:35:41,UTC,158666182,ThyphoonAlert,ThyphoonAlert:: HURRICANE ALEX IN MONTERREY - HURACAN ALEX EN MONTERREY  http://unfake.it/UOhZ,0,0,0,,[],https://twitter.com/ThyphoonAlert/status/4014648336588800/
3987391492657152,2010-11-14,01:47:22,UTC,202889197,ShhhSunshine,"@HurricaneAlex Little tired, were you? Ahahaa that was funny :D",0,0,0,,[],https://twitter.com/ShhhSunshine/status/3987391492657152/
3903010140852225,2010-11-14,20:12:04,UTC,135596212,MaxiNews,Mexico and Texas coasts threatened by Hurricane Alex | MaxiNews.co.uk  http://bit.ly/aEvj8D,0,0,0,,[],https://twitter.com/MaxiNews/status/3903010140852225/
3828988652818432,2010-11-14,15:17:56,UTC,124739463,koinukawf,Halfway Through 2010   NashvilleWX  http://bit.ly/cYfWmF hurricane alex !,0,0,0,,[],https://twitter.com/koinukawf/status/3828988652818432/
3557252464123904,2010-11-13,21:18:09,UTC,135596212,MaxiNews,Mexico and Texas coasts threatened by Hurricane Alex | MaxiNews.co.uk  http://bit.ly/aEvj8D,0,0,0,,[],https://twitter.com/MaxiNews/status/3557252464123904/
3337972120289281,2010-11-12,06:46:49,UTC,178270553,edahjh43," http://www.clickanimation.info/forum/index.php?action=profile;u=1483 Houston may see Hurricane Alex yet, the following hardly any days will",0,0,0,,[],https://twitter.com/edahjh43/status/3337972120289281/
2862194035269632,2010-11-11,23:16:14,UTC,89003255,dddanadine,This supposed hurricane is nasty! I like hurricane alex more! Atleast I sunbathed.,0,0,0,,[],https://twitter.com/dddanadine/status/2862194035269632/
2841109017403392,2010-11-11,21:52:27,UTC,177329586,billweckos,2010 Hurricane Season review: Mexico and Central America has taken it on the chin from Hurricane Alex early in t...  http://bit.ly/auP6e4,0,0,0,,[],https://twitter.com/billweckos/status/2841109017403392/
2360602282430464,2010-11-10,14:03:06,UTC,124744444,lengxc,:P hurricane alex  http://bit.ly/cYfWmF Halfway Through 2010   NashvilleWX,0,0,0,,[],https://twitter.com/lengxc/status/2360602282430464/
2121030118150144,2010-11-09,22:11:07,UTC,177904774,laurelgle12," http://ping.fm/GGmFh Hurricane Alex has chose to pay an early visit this year. Being the first June Atlantic hurricane since 1995, lifetime",0,0,0,,[],https://twitter.com/laurelgle12/status/2121030118150144/
1577466833403905,2010-11-08,10:11:12,UTC,181302618,asainternet,hurricane+alex+in+mexico+2010  http://asaim.com/a2z/f.php/keyword/hurricane%2Balex%2Bin%2Bmexico%2B2010,0,0,0,,[],https://twitter.com/asainternet/status/1577466833403905/
1392908817137664,2010-11-07,21:57:50,UTC,181302618,asainternet,pictures+of+hurricane+alex+in+mexico  http://asaim.com/a2z/f.php/keyword/pictures%2Bof%2Bhurricane%2Balex%2Bin%2Bmexico,0,0,0,,[],https://twitter.com/asainternet/status/1392908817137664/
1342154370719744,2010-11-07,18:36:09,UTC,181302618,asainternet,hurricane+alex+in+mexico  http://asaim.com/a2z/f.php/keyword/hurricane%2Balex%2Bin%2Bmexico,0,0,0,,[],https://twitter.com/asainternet/status/1342154370719744/
